{
  "schema_version": 1,
  "product": "workshop",
  "channel": "alpha",
  "version": "0.2.7",
  "tag": "v0.2.7",
  "published_at": "2026-10-04T17:35:40Z",
  "release_repo": "vagdotdev/grokbuildfork",
  "release_url": "https://github.com/vagdotdev/grokbuildfork/releases/tag/v0.2.7",
  "checksums_url": "https://github.com/vagdotdev/grokbuildfork/releases/download/v0.2.7/SHA256SUMS",
  "attested": true,
  "previous_version": "0.2.6",
  "previous_tag": "v0.2.6",
  "artifacts": {
    "linux-aarch64": {
      "url": "https://github.com/vagdotdev/grokbuildfork/releases/download/v0.2.7/workshop-0.2.7-linux-aarch64.tar.gz",
      "sha256": "a8c257d785045eebd5205606a7c84de0a7c697790fa2b2e39148006381bb9795",
      "size": 66115557,
      "format": "tar.gz",
      "binary": "workshop"
    },
    "linux-x86_64": {
      "url": "https://github.com/vagdotdev/grokbuildfork/releases/download/v0.2.7/workshop-0.2.7-linux-x86_64.tar.gz",
      "sha256": "42f7e3e9f8781264bed217d5197a79e77d0fec61bc3c8162861a1a0f5640abf3",
      "size": 69248786,
      "format": "tar.gz",
      "binary": "workshop"
    },
    "macos-aarch64": {
      "url": "https://github.com/vagdotdev/grokbuildfork/releases/download/v0.2.7/workshop-0.2.7-macos-aarch64.tar.gz",
      "sha256": "1468f08f9ea66011971bedc618ef09bee55993615f7b4c12b2fdc7678e8e3292",
      "size": 61313593,
      "format": "tar.gz",
      "binary": "workshop"
    },
    "macos-x86_64": {
      "url": "https://github.com/vagdotdev/grokbuildfork/releases/download/v0.2.7/workshop-0.2.7-macos-x86_64.tar.gz",
      "sha256": "f8c9246854d7e4af486cd57a487836c63e80783377b4cea2887f9359e38f7566",
      "size": 64628434,
      "format": "tar.gz",
      "binary": "workshop"
    }
  }
}
