{
  "schema_version": 1,
  "product": "workshop",
  "channel": "stable",
  "version": "0.2.6",
  "tag": "v0.2.6",
  "published_at": "2026-10-04T06:47:52Z",
  "release_repo": "vagdotdev/grokbuildfork",
  "release_url": "https://github.com/vagdotdev/grokbuildfork/releases/tag/v0.2.6",
  "checksums_url": "https://github.com/vagdotdev/grokbuildfork/releases/download/v0.2.6/SHA256SUMS",
  "attested": true,
  "previous_version": "0.2.5",
  "previous_tag": "v0.2.5",
  "artifacts": {
    "linux-aarch64": {
      "url": "https://github.com/vagdotdev/grokbuildfork/releases/download/v0.2.6/workshop-0.2.6-linux-aarch64.tar.gz",
      "sha256": "55e439bed471d212df344a886774293f36f8771a557470b26aee23606aa799ed",
      "size": 66060797,
      "format": "tar.gz",
      "binary": "workshop"
    },
    "linux-x86_64": {
      "url": "https://github.com/vagdotdev/grokbuildfork/releases/download/v0.2.6/workshop-0.2.6-linux-x86_64.tar.gz",
      "sha256": "f801d8973cd6b2a59d901b6f22d5dcbd755422fa22207b6a882865708068c98f",
      "size": 69170428,
      "format": "tar.gz",
      "binary": "workshop"
    },
    "macos-aarch64": {
      "url": "https://github.com/vagdotdev/grokbuildfork/releases/download/v0.2.6/workshop-0.2.6-macos-aarch64.tar.gz",
      "sha256": "a81d2c94d798c17282f815234e16bcf244337a1cc0cb0f245838c7eec7a65c30",
      "size": 61249958,
      "format": "tar.gz",
      "binary": "workshop"
    },
    "macos-x86_64": {
      "url": "https://github.com/vagdotdev/grokbuildfork/releases/download/v0.2.6/workshop-0.2.6-macos-x86_64.tar.gz",
      "sha256": "b5e4375e67d459b70c4c05bc28cd4a55555f3f83e4816839214a7d688c43e388",
      "size": 64634776,
      "format": "tar.gz",
      "binary": "workshop"
    }
  }
}
